{"$schema":"http://json-schema.org/draft-07/schema#","type":"object","additionalProperties":false,"required":["schemaVersion","state","storySlug","authorization","promotionDate","stewardship","deltaDispositions","modifiedFiles","completedAt","result","rollback"],"properties":{"schemaVersion":{"const":2},"state":{"enum":["not-prepared","ready","completed"]},"storySlug":{"type":"string","pattern":"^[a-z0-9]+(?:-[a-z0-9]+)*$"},"authorization":{"anyOf":[{"type":"null"},{"type":"object","additionalProperties":false,"required":["requestedBy","authorizedAt","basis"],"properties":{"requestedBy":{"type":"string","minLength":1},"authorizedAt":{"type":"string","minLength":1},"basis":{"type":"string","minLength":1}}}]},"promotionDate":{"type":["string","null"]},"stewardship":{"anyOf":[{"type":"null"},{"type":"object","additionalProperties":false,"required":["identity","handoffText","authorityRecheck","nameCheck"],"properties":{"identity":{"type":"string","minLength":1},"handoffText":{"type":"string","minLength":1},"authorityRecheck":{"enum":["PASS","USER_RULING_REQUIRED","FAILED"]},"nameCheck":{"enum":["VERIFIED","FAILED"]}}}]},"deltaDispositions":{"type":"array","items":{"type":"object","required":["id","disposition","target","rationale"],"properties":{"id":{"type":"string","minLength":1},"disposition":{"enum":["promote","story-local","defer","reject"]},"target":{"type":["string","null"]},"rationale":{"type":"string","minLength":1}},"additionalProperties":false}},"modifiedFiles":{"type":"array","items":{"type":"string"}},"completedAt":{"type":["string","null"]},"result":{"type":["string","null"]},"rollback":{"type":"object","additionalProperties":false,"required":["attempted","succeeded","detail"],"properties":{"attempted":{"type":"boolean"},"succeeded":{"type":["boolean","null"]},"detail":{"type":["string","null"]}}}}}
