{"schemaVersion":2,"state":"not-prepared","storySlug":"life-with-a-girlfriend-with-shrinking-powers","authorization":null,"promotionDate":null,"stewardship":null,"deltaDispositions":[],"modifiedFiles":[],"completedAt":null,"result":null,"rollback":{"attempted":false,"succeeded":null,"detail":null}}
